{
  "api_version": "scenery.generated.v1",
  "artifact_kind": "go_application_adapters",
  "content_digest": "sha256:79bc02c1e7e18967f32c14682278ce726c81025ad9db6849e692aee6bc04b96b",
  "contract_revision": "sha256:bdcdc3efe46a7ed61994badb8c55c0f7b5a6b7f8311be7f3512efe47c91ea0ae",
  "covered": [
    "house/binding/process_scene_http",
    "house/binding/process_scene_internal",
    "house/execution/process_scene_direct",
    "house/operation/process_scene",
    "house/service/house"
  ],
  "files": [
    "composition/composition.gen.go",
    "house_house_adapter/adapter.gen.go"
  ],
  "generator": "scenery.vnext.go-application",
  "generator_version": "1",
  "http_surface_revisions": {
    "app/http_gateway/public_api": "sha256:03c8792bdbc2d53d5ac3076f53b6d9f5ae4f33c33d26d4e35a82d615e4ea3e79"
  },
  "implementation_revision": null,
  "openapi_revisions": {
    "app/http_gateway/public_api": "sha256:58354b21f1376eca62167255f54e2b5700a8e64f2028f07bb0ede1b3345ee661"
  },
  "package_contract_abi_revisions": {
    "example.test/nativeapp/house/scenerycontract": "sha256:5c180808dd4d9608f6985a306ef4552276ff7aa1f7e3d8481d95c55a069d7c44"
  },
  "provider_capability_abis": {},
  "runtime_abi": "scenery.go-runtime/v1",
  "runtime_abi_range": "scenery.go-runtime/v1"
}
