{
  "api_version": "scenery.generated.v1",
  "artifact_kind": "go_application_adapters",
  "content_digest": "sha256:f00e7b1ff366cc6dc305082b5dfbd1ad8a29da763878a483e03e99a73740fe02",
  "contract_revision": "sha256:004e2e130423583d492e4e7e75b245fd7a715c647c618a13714e22493be8acae",
  "covered": [
    "bridge/binding/echo_http",
    "bridge/execution/echo_direct",
    "bridge/operation/echo",
    "bridge/service/bridge"
  ],
  "files": [
    "bridge_bridge_adapter/adapter.gen.go",
    "composition/composition.gen.go"
  ],
  "generator": "scenery.vnext.go-application",
  "generator_version": "1",
  "http_surface_revisions": {
    "app/http_gateway/public_api": "sha256:86ce560b51e1514331ca49a00ccc3311a7c6e2a4e4682debae0a205397f1799f"
  },
  "implementation_revision": null,
  "openapi_revisions": {
    "app/http_gateway/public_api": "sha256:0f06a6eb29cf4279c9e7d42b9191c5bf203e93da8db31c037b51ae1b1ec31111"
  },
  "package_contract_abi_revisions": {
    "example.test/bridgeapp/bridge/scenerycontract": "sha256:c3ab08e744f605127adf60796dacb4b1010800f400a669496d9c605966f9d2e9"
  },
  "provider_capability_abis": {},
  "runtime_abi": "scenery.go-runtime/v1",
  "runtime_abi_range": "scenery.go-runtime/v1"
}
