{
  "api_version": "scenery.generated.v1",
  "artifact_kind": "go_application_adapters",
  "content_digest": "sha256:864631bce0625825a0512f6227678c73d0a632e461c92cf345165b0c8386b24d",
  "contract_revision": "sha256:9fc22974ac02542ff7b31fa7b556f410395cdedb5b613f7c7e2bb73056b5241b",
  "covered": [
    "service/binding/public_storage_probe_http",
    "service/binding/read_public_storage_probe_http",
    "service/execution/public_storage_probe_direct",
    "service/execution/read_public_storage_probe_direct",
    "service/operation/public_storage_probe",
    "service/operation/read_public_storage_probe",
    "service/service/service"
  ],
  "files": [
    "composition/composition.gen.go",
    "service_service_adapter/adapter.gen.go"
  ],
  "generator": "scenery.vnext.go-application",
  "generator_version": "1",
  "http_surface_revisions": {
    "app/http_gateway/public_api": "sha256:248d1fcb1a6c35f3935ac95cad2bb90fcff7c5f0568ae882a82c51d5f68bf23c"
  },
  "implementation_revision": null,
  "openapi_revisions": {
    "app/http_gateway/public_api": "sha256:2640996298f3a3d19f7938553baf4c6fafe3f97275f3084a19832d8837f628b2"
  },
  "package_contract_abi_revisions": {
    "example.com/storagebasic/service/scenerycontract": "sha256:31deb75575aceb51fd0c00f9e2d4517d6f38909bba9b04e1774d7f1a0b224b21"
  },
  "provider_capability_abis": {},
  "runtime_abi": "scenery.go-runtime/v1",
  "runtime_abi_range": "scenery.go-runtime/v1"
}
